{
  "$id": "trustamp/invoice/1.0/schema.json",
  "$schema": "http://json-schema.org/draft-07/schema#",
  "type": "object",
  "properties": {
    "version": {
      "type": "string",
      "const": "https://schema.openattestation.com/2.0/schema.json"
    },
    "id": {
      "type": "string"
    },
    "$template": {
      "type": "object",
      "required": ["name", "type", "url"],
      "properties": {
        "name": {
          "type": "string",
          "const": "INVOICE"
        },
        "type": {
          "type": "string",
          "const": "EMBEDDED_RENDERER"
        },
        "url": {
          "type": "string"
        }
      }
    },
    "issuers": {
      "type": "array",
      "minItems": 1,
      "items": {
        "type": "object",
        "required": ["id", "name", "identityProof"],
        "properties": {
          "id": {
            "type": "string",
            "format": "uri"
          },
          "name": {
            "type": "string"
          },
          "revocation": {
            "type": "object",
            "properties": {
              "type": {
                "type": "string",
                "enum": ["NONE"]
              }
            }
          },
          "identityProof": {
            "type": "object",
            "required": ["type", "location"],
            "properties": {
              "type": {
                "type": "string",
                "enum": ["DNS-DID"]
              },
              "location": {
                "type": "string"
              },
              "key": {
                "type": "string"
              }
            }
          }
        }
      }
    },
    "recipient": {
      "type": "object",
      "properties": {
        "name": {
          "type": "string"
        },
        "company": {
          "type": "object",
          "properties": {
            "name": {
              "type": "string"
            },
            "streetAddress": {
              "type": "string"
            },
            "city": {
              "type": "string"
            },
            "postalCode": {
              "type": "string"
            },
            "phoneNumber": {
              "type": "string"
            }
          }
        }
      }
    },
    "invoiceDetails": {
      "type": "object",
      "required": ["invoiceNumber", "date"],
      "properties": {
        "invoiceNumber": {
          "type": "string"
        },
        "date": {
          "type": "string"
        },
        "billFrom": {
          "type": "object",
          "properties": {
            "name": {
              "type": "string"
            },
            "streetAddress": {
              "type": "string"
            },
            "city": {
              "type": "string"
            },
            "postalCode": {
              "type": "string"
            },
            "phoneNumber": {
              "type": "string"
            }
          }
        },
        "billTo": {
          "type": "object",
          "properties": {
            "company": {
              "type": "object",
              "properties": {
                "name": {
                  "type": "string"
                },
                "streetAddress": {
                  "type": "string"
                },
                "city": {
                  "type": "string"
                },
                "postalCode": {
                  "type": "string"
                },
                "phoneNumber": {
                  "type": "string"
                }
              }
            },
            "name": {
              "type": "string"
            },
            "email": {
              "type": "string"
            }
          }
        }
      }
    },
    "billableItems": {
      "type": "array",
      "items": {
        "type": "object",
        "properties": {
          "description": {
            "type": "string"
          },
          "quantity": {
            "type": "number"
          },
          "unitPrice": {
            "type": "number"
          },
          "amount": {
            "type": "number"
          }
        }
      }
    },
    "subtotal": {
      "type": "number"
    },
    "tax": {
      "type": "number"
    },
    "taxTotal": {
      "type": "number"
    },
    "total": {
      "type": "number"
    }
  },
  "required": ["version", "id", "$template", "issuers", "invoiceDetails"]
}